<?xml version="1.0"?>
<pse
xmlns:xsi="http://www.w3.org/2001/XMLSchema-instance"
xsi:noNamespaceSchemaLocation="InputSetting.xsd">

	<start_time>0.0</start_time>
	<t_end>500</t_end>
	<delta_t>0.01</delta_t>
	<numberOfTypes>1</numberOfTypes>
	
	<gconst>-0.001</gconst>
	
	<!-- true: smoothed LJ, false: LJ -->
	<force>false</force>
		
	<!-- Short range, linked cell algorithm -->
	<lc>
		<domainsize>
			<domainX>148.0</domainX>
			<domainY>148.0</domainY>
			<domainZ>148.0</domainZ>
		</domainsize>
		<rcutoff>4.0</rcutoff>
	
		<!-- 1=outflow, 2=reflecting, 3=periodic for 6 boundaries -->
		<!-- left side -->
		<condition>3</condition>

		<!-- right -->
		<condition>3</condition>

		<!-- ground -->
		<condition>3</condition>

		<!-- upper -->
		<condition>3</condition>

		<!-- front -->
		<condition>2</condition>

		<!-- behind -->
		<condition>3</condition>
	</lc>	
	
	<!-- Thermostats -->
	<thermo>
		<enabled>false</enabled>
		<brownianFlag>true</brownianFlag>
		<initT>0.5</initT>
		<targetT>80</targetT>
		<deltaT>0</deltaT>
		<nThermo>1000</nThermo>
		<nDelta>40000</nDelta>
	</thermo>

	<inputfile>
		<name>input/MembraneCuboid.xml</name>
		<!-- particles/cuboids/spheres -->
		<type>cuboids</type>
	</inputfile>
	
	<outputfile>
		<name>MembraneVTK</name>
		<freq>10</freq>
	</outputfile>
</pse>
